<?xml version="1.0" encoding="UTF-8" standalone="no" ?>
<data xmlns="http://example.com/inherent" xmlns:xsi="http://www.w3.org/2001/XMLSchema-instance" xsi:schemaLocation="http://example.com/inherent ./xsd/InherentDataSource.xsd">
  <riskName>Risiko Stratejik</riskName>
  <list>
    <item>
      <code/>
      <consolidate>0</consolidate>
      <dataName/>
      <detail/>
      <id>434</id>
    </item>
    <item>
      <code>SI07001000</code>
      <consolidate>0</consolidate>
      <dataName>Visi &amp; Misi LJK </dataName>
      <consolidationRule>
        
        var items = companyValuesByCode("SI07001000");   // map[string] -&gt; []int

print(items);
print("awkwk");

// counts[1]..counts[5] used; counts[0] unused
var counts = [0.0, 0.0, 0.0, 0.0, 0.0, 0.0];

var total = 0.0;

// Each company contributes ONE vote based on the size of its []int
for (entry : items) {
    var sz = entry.second.size();
    if (sz &gt;= 1 &amp;&amp; sz &lt;= 5) {
        counts[sz] = counts[sz] + 1.0;
        total = total + 1.0;
    }
}

if (total == 0.0) { return 0.0; }

var half = total / 2.0;
var cumulative = 0.0;

// Walk through buckets 1..5
for (i : [1,2,3,4,5]) {
    cumulative = cumulative + counts[i];
    if (cumulative &gt; half) {
        return i * 1.0;   // return as float
    }
}

print(cumulative);
return 0.0;
        
      </consolidationRule>
      <detail/>
      <id>338</id>
    </item>
    <item>
      <code>SI07002000</code>
      <consolidate>0</consolidate>
      <dataName>Kultur organisasi, terutama jika penetapan tujuan stratejik mensyaratkan perubahan struktur organisasi dan penyesuaian proses bisnis;</dataName>
      <consolidationRule>
        
var items = companyValuesByCode("SI07002000");

// counts[1]..counts[5] used; counts[0] unused
var counts = [0.0, 0.0, 0.0, 0.0, 0.0, 0.0];

var total = 0.0;

for (entry : items) {
    var sz = entry.second.size();
    if (sz &gt;= 1 &amp;&amp; sz &lt;= 5) {
        counts[sz] = counts[sz] + 1.0;
        total = total + 1.0;
    }
}

if (total == 0.0) { return 0.0; }

var half = total / 2.0;
var cumulative = 0.0;

// Walk through buckets 1..5
for (i : [1,2,3,4,5]) {
    cumulative = cumulative + counts[i];
    if (cumulative &gt; half) {
        return i * 1.0;
    }
}

return 0.0;
        
      </consolidationRule>
      <detail/>
      <id>339</id>
    </item>
    <item>
      <code>SI07003000</code>
      <consolidate>0</consolidate>
      <dataName>Faktor kemampuan organisasi yang mencakup antara lain sumber daya manusia, infrastruktur, dan sistem informasi manajemen;</dataName>
      <consolidationRule>
        
var items = companyValuesByCode("SI07003000");

// counts[1]..counts[5] used; counts[0] unused
var counts = [0.0, 0.0, 0.0, 0.0, 0.0, 0.0];

var total = 0.0;

for (entry : items) {
    var sz = entry.second.size();
    if (sz &gt;= 1 &amp;&amp; sz &lt;= 5) {
        counts[sz] = counts[sz] + 1.0;
        total = total + 1.0;
    }
}

if (total == 0.0) { return 0.0; }

var half = total / 2.0;
var cumulative = 0.0;

// Walk through buckets 1..5
for (i : [1,2,3,4,5]) {
    cumulative = cumulative + counts[i];
    if (cumulative &gt; half) {
        return i * 1.0;
    }
}

return 0.0;
        
      </consolidationRule>
      <detail/>
      <id>340</id>
    </item>
    <item>
      <code>SI07004000</code>
      <consolidate>0</consolidate>
      <dataName>CAR</dataName>
      <consolidationRule>
        
        var items = companyValuesByCode("SI07004000");

var acc = 0.0;
var c = 0;

for (entry : items) {
    acc = acc + sum(entry.second);
    c = c + 1;
}

if (c == 0) { return 0.0; }

return acc * 1.0 / c * 1.0;
        
      </consolidationRule>
      <detail/>
      <id>341</id>
    </item>
    <item>
      <code>SI07005000</code>
      <consolidate>0</consolidate>
      <dataName>RBC</dataName>
      <consolidationRule>
        
        var items = companyValuesByCode("SI07005000");

var acc = 0.0;
var c = 0;

for (entry : items) {
    acc = acc + sum(entry.second);
    c = c + 1;
}

if (c == 0) { return 0.0; }

return acc * 1.0 / c * 1.0;
        
      </consolidationRule>
      <detail/>
      <id>342</id>
    </item>
    <item>
      <code>SI07006000</code>
      <consolidate>0</consolidate>
      <dataName>Gearing Ratio</dataName>
      <consolidationRule>
        
        var items = companyValuesByCode("SI07006000");

var acc = 0.0;
var c = 0;

for (entry : items) {
    acc = acc + sum(entry.second);
    c = c + 1;
}

if (c == 0) { return 0.0; }

return acc * 1.0 / c * 1.0;
        
      </consolidationRule>
      <detail/>
      <id>343</id>
    </item>
    <item>
      <code>SI07007000</code>
      <consolidate>0</consolidate>
      <dataName>MKBD Sinarmas Sekuritas</dataName>
      <consolidationRule>
        
        var items = companyValuesByCode("SI07007000");

var acc = 0.0;

for (entry : items) {
    acc = acc + sum(entry.second);
}

return acc;
        
      </consolidationRule>
      <detail/>
      <id>344</id>
    </item>
    <item>
      <code>SI07008000</code>
      <consolidate>0</consolidate>
      <dataName>MKBD Sinarmas Asset Management</dataName>
      <consolidationRule>
        
        var items = companyValuesByCode("SI07008000");

var acc = 0.0;

for (entry : items) {
    acc = acc + sum(entry.second);
}

return acc;
        
      </consolidationRule>
      <detail/>
      <id>345</id>
    </item>
    <item>
      <code>SI07009000</code>
      <consolidate>0</consolidate>
      <dataName>Jumlah Pengenbangan Sistem Informasi Teknologi yang dilakukan pada periode pelaporan</dataName>
      <consolidationRule>
        
var items = companyValuesByCode("SI07009000");

// counts[1]..counts[5] used; counts[0] unused
var counts = [0.0, 0.0, 0.0, 0.0, 0.0, 0.0];

var total = 0.0;

// Each company contributes ONE vote based on the size of its []int
for (entry : items) {
    var sz = entry.second.size();
    if (sz &gt;= 1 &amp;&amp; sz &lt;= 5) {
        counts[sz] = counts[sz] + 1.0;
        total = total + 1.0;
    }
}

if (total == 0.0) { return 0.0; }

var half = total / 2.0;
var cumulative = 0.0;

// Walk through buckets 1..5
for (i : [1,2,3,4,5]) {
    cumulative = cumulative + counts[i];
    if (cumulative &gt; half) {
        return i * 1.0;
    }
}

return 0.0;
        
      </consolidationRule>
      <detail/>
      <id>350</id>
    </item>
    <item>
      <code>SI07010000</code>
      <consolidate>0</consolidate>
      <dataName>Tingkat Persaingan Usaha</dataName>
      <consolidationRule>
        
        var items = companyValuesByCode("SI07010000");

var total = 0.0;
var count = 0.0;

for (entry : items) {
    total = total + sum(entry.second);
    count = count + size(entry.second);
}

if (count == 0.0) {
    return 0.0;
}

return round(total / count);
        
      </consolidationRule>
      <detail/>
      <id>351</id>
    </item>
    <item>
      <code>SI07011000</code>
      <consolidate>0</consolidate>
      <dataName>Strategi berisiko rendah adalah strategi di mana LJK dalam Konglomerasi Keuangan melakukan kegiatan usaha pada pangsa pasar dan nasabah yang telah dikenal sebelumnya atau menyediakan produk yang bersifat tradisional sehingga tingkat pertumbuhan usaha cenderung stabil dan dapat diprediksi.&#xD;
 &#xD;
 Strategi berisiko tinggi adalah strategi di mana LJK dalam Konglomerasi Keuangan berencana masuk dalam area bisnis baru, baik pangsa pasar, produk atau jasa, atau nabasah baru.</dataName>
      <consolidationRule>
        
var items = companyValuesByCode("SI07011000");

// counts[1]..counts[5] used; counts[0] unused
var counts = [0.0, 0.0, 0.0, 0.0, 0.0, 0.0];

var total = 0.0;

for (entry : items) {
    var sz = entry.second.size();
    if (sz &gt;= 1 &amp;&amp; sz &lt;= 5) {
        counts[sz] = counts[sz] + 1.0;
        total = total + 1.0;
    }
}

if (total == 0.0) { return 0.0; }

var half = total / 2.0;
var cumulative = 0.0;

// Walk through buckets 1..5
for (i : [1,2,3,4,5]) {
    cumulative = cumulative + counts[i];
    if (cumulative &gt; half) {
        return i * 1.0;
    }
}

return 0.0;
        
      </consolidationRule>
      <detail/>
      <id>356</id>
    </item>
    <item>
      <code>SI07012000</code>
      <consolidate>0</consolidate>
      <dataName>Market Share Total Aset KK (Bank) terhadap Aset Industri Jasa Perbankan</dataName>
      <consolidationRule>
        
        //
// SI07012001 — SUM
//
var items_01 = companyValuesByCode("SI07012001");

var sum_01 = 0.0;

for (entry : items_01) {
    sum_01 = sum_01 + sum(entry.second);
}

//
// SI07012002 — SUM
//
var items_02 = companyValuesByCode("SI07012002");

var sum_02 = 0.0;

for (entry : items_02) {
    sum_02 = sum_02 + sum(entry.second);
}

//
// Final result: SI07012001 / SI07012002
//
if (sum_02 == 0) {
    return 0.0;
}

return sum_01 * 1.0 / sum_02 * 1.0;
        
      </consolidationRule>
      <detail/>
      <id>357</id>
    </item>
    <item>
      <code>SI07012001</code>
      <consolidate>0</consolidate>
      <dataName>Total Aset Bank</dataName>
      <consolidationRule>
        
        var items = companyValuesByCode("SI07012001");

var acc = 0.0;

for (entry : items) {
    acc = acc + sum(entry.second);
}

return acc;
        
      </consolidationRule>
      <detail/>
      <id>281</id>
    </item>
    <item>
      <code>SI07012002</code>
      <consolidate>0</consolidate>
      <dataName>Total Aset Industri Jasa Perbankan</dataName>
      <consolidationRule>
        
        var items = companyValuesByCode("SI07012002");

var acc = 0.0;

for (entry : items) {
    acc = acc + sum(entry.second);
}

return acc;
        
      </consolidationRule>
      <detail/>
      <id>336</id>
    </item>
    <item>
      <code>SI07013000</code>
      <consolidate>0</consolidate>
      <dataName>Market Share Total Aset KK (Pembiayaan) terhadap Aset Industri Jasa IKNB (Pembiayaan)&#xD;
&#xD;
(Total aset perusahaan pembiayaan terhadap total aset industri pembiayaan)&#xD;
</dataName>